{
  "schemaVersion": "1.0.0",
  "milestone": "M2",
  "gate": "GATE-4",
  "checkpoint": "GATE-4-CP-0001",
  "step": "G4-S07",
  "lastCompletedStep": "G4-S06",
  "localCommit": "43e9816b54dcdef3a15f12494e6bb5c3fa310805",
  "remoteCommit": "43e9816b54dcdef3a15f12494e6bb5c3fa310805",
  "branch": "main",
  "status": "IN_PROGRESS",
  "blockers": [],
  "nextAction": "Derive the canonical counts and program state, complete the closure documents, and run the internal milestone mirror audit.",
  "updatedAt": "2026-10-10T05:58:06Z"
}
